gp_id,symbol,name,uniprot_id,source
A6NDR6,MEIS3P1,Putative homeobox protein Meis3-like 1,A6NDR6,UniProt;GO
A8K0S8,MEIS3P2,Putative homeobox protein Meis3-like 2,A8K0S8,UniProt;GO
O00470,MEIS1,Homeobox protein Meis1,O00470,UniProt;GO
O00522,KRIT1,Krev interaction trapped protein 1 (Krev interaction trapped 1) (Cerebral cavernous malformations 1 protein),O00522,UniProt;GO
O00755,WNT7A,Protein Wnt-7a,O00755,UniProt;GO
O14713,ITGB1BP1,Integrin beta-1-binding protein 1 (Integrin cytoplasmic domain-associated protein 1) (ICAP-1),O14713,UniProt;GO
O14786,NRP1,Neuropilin-1 (Vascular endothelial cell growth factor 165 receptor) (CD antigen CD304),O14786,UniProt;GO
O14944,EREG,Proepiregulin [Cleaved into: Epiregulin (EPR)],O14944,UniProt;GO
O15041,SEMA3E,Semaphorin-3E,O15041,UniProt;GO
O15123,ANGPT2,Angiopoietin-2 (ANG-2),O15123,UniProt;GO
O15431,SLC31A1,High affinity copper uptake protein 1 (Copper transporter 1) (hCTR1) (Solute carrier family 31 member 1) [Cleaved into: Truncated CTR1 form],O15431,UniProt;GO
O15520,FGF10,Fibroblast growth factor 10 (FGF-10) (Keratinocyte growth factor 2),O15520,UniProt;GO
O43365,HOXA3,Homeobox protein Hox-A3 (Homeobox protein Hox-1E),O43365,UniProt;GO
O43435,TBX1,T-box transcription factor TBX1 (T-box protein 1) (Testis-specific T-box protein),O43435,UniProt;GO
O43508,TNFSF12,"Tumor necrosis factor ligand superfamily member 12 (APO3 ligand) (TNF-related weak inducer of apoptosis) (TWEAK) [Cleaved into: Tumor necrosis factor ligand superfamily member 12, membrane form; Tumor necrosis factor ligand superfamily member 12, secreted form]",O43508,UniProt;GO
O43915,VEGFD,Vascular endothelial growth factor D (VEGF-D) (c-Fos-induced growth factor) (FIGF),O43915,UniProt;GO
O60243,HS6ST1,Heparan-sulfate 6-O-sulfotransferase 1 (HS6ST-1) (EC 2.8.2.-),O60243,UniProt;GO
O60462,NRP2,Neuropilin-2 (Vascular endothelial cell growth factor 165 receptor 2),O60462,UniProt;GO
O60565,GREM1,"Gremlin-1 (Cell proliferation-inducing gene 2 protein) (Cysteine knot superfamily 1, BMP antagonist 1) (DAN domain family member 2) (Down-regulated in Mos-transformed cells protein) (Increased in high glucose protein 2) (IHG-2)",O60565,UniProt;GO
O60687,SRPX2,Sushi repeat-containing protein SRPX2 (Sushi-repeat protein upregulated in leukemia),O60687,UniProt;GO
O60894,RAMP1,Receptor activity-modifying protein 1 (Calcitonin-receptor-like receptor activity-modifying protein 1) (CRLR activity-modifying protein 1),O60894,UniProt;GO
O60895,RAMP2,Receptor activity-modifying protein 2 (Calcitonin-receptor-like receptor activity-modifying protein 2) (CRLR activity-modifying protein 2),O60895,UniProt;GO
O75340,PDCD6,Programmed cell death protein 6 (Apoptosis-linked gene 2 protein homolog) (ALG-2),O75340,UniProt;GO
O75351,VPS4B,Vacuolar protein sorting-associated protein 4B (EC 3.6.4.6) (Cell migration-inducing gene 1 protein) (Suppressor of K(+) transport growth defect 1) (Protein SKD1),O75351,UniProt;GO
O76093,FGF18,Fibroblast growth factor 18 (FGF-18) (zFGF5),O76093,UniProt;GO
O95398,RAPGEF3,Rap guanine nucleotide exchange factor 3 (Exchange factor directly activated by cAMP 1) (Exchange protein directly activated by cAMP 1) (EPAC 1) (Rap1 guanine-nucleotide-exchange factor directly activated by cAMP) (cAMP-regulated guanine nucleotide exchange factor I) (cAMP-GEFI),O95398,UniProt;GO
O95859,TSPAN12,Tetraspanin-12 (Tspan-12) (Tetraspan NET-2) (Transmembrane 4 superfamily member 12),O95859,UniProt;GO
O95971,CD160,"CD160 antigen (Natural killer cell receptor BY55) (CD antigen CD160) [Cleaved into: CD160 antigen, soluble form]",O95971,UniProt;GO
O96004,HAND1,"Heart- and neural crest derivatives-expressed protein 1 (Class A basic helix-loop-helix protein 27) (bHLHa27) (Extraembryonic tissues, heart, autonomic nervous system and neural crest derivatives-expressed protein 1) (eHAND)",O96004,UniProt;GO
P01127,PDGFB,Platelet-derived growth factor subunit B (PDGF subunit B) (PDGF-2) (Platelet-derived growth factor B chain) (Platelet-derived growth factor beta polypeptide) (Proto-oncogene c-Sis) (Becaplermin),P01127,UniProt;GO
P01133,EGF,Pro-epidermal growth factor (EGF) [Cleaved into: Epidermal growth factor (Urogastrone)],P01133,UniProt;GO
P01135,TGFA,Protransforming growth factor alpha [Cleaved into: Transforming growth factor alpha (TGF-alpha) (EGF-like TGF) (ETGF) (TGF type 1)],P01135,UniProt;GO
P02462,COL4A1,Collagen alpha-1(IV) chain [Cleaved into: Arresten],P02462,UniProt;GO
P02751,FN1,Fibronectin (FN) (Cold-insoluble globulin) (CIG) [Cleaved into: Anastellin; Ugl-Y1; Ugl-Y2; Ugl-Y3],P02751,UniProt;GO
P03950,ANG,Angiogenin (EC 3.1.27.-) (Ribonuclease 5) (RNase 5),P03950,UniProt;GO
P04085,PDGFA,Platelet-derived growth factor subunit A (PDGF subunit A) (PDGF-1) (Platelet-derived growth factor A chain) (Platelet-derived growth factor alpha polypeptide),P04085,UniProt;GO
P04196,HRG,Histidine-rich glycoprotein (Histidine-proline-rich glycoprotein) (HPRG),P04196,UniProt;GO
P04216,THY1,Thy-1 membrane glycoprotein (CDw90) (Thy-1 antigen) (CD antigen CD90),P04216,UniProt;GO
P05090,APOD,Apolipoprotein D (Apo-D) (ApoD),P05090,UniProt;GO
P05106,ITGB3,Integrin beta-3 (Platelet membrane glycoprotein IIIa) (GPIIIa) (CD antigen CD61),P05106,UniProt;GO
P05121,SERPINE1,Plasminogen activator inhibitor 1 (PAI) (PAI-1) (Endothelial plasminogen activator inhibitor) (Serpin E1),P05121,UniProt;GO
P05230,FGF1,Fibroblast growth factor 1 (FGF-1) (Acidic fibroblast growth factor) (aFGF) (Endothelial cell growth factor) (ECGF) (Heparin-binding growth factor 1) (HBGF-1),P05230,UniProt;GO
P05412,JUN,Transcription factor Jun (Activator protein 1) (AP1) (Proto-oncogene c-Jun) (Transcription factor AP-1 subunit Jun) (V-jun avian sarcoma virus 17 oncogene homolog) (p39),P05412,UniProt;GO
P05556,ITGB1,Integrin beta-1 (Fibronectin receptor subunit beta) (Glycoprotein IIa) (GPIIA) (VLA-4 subunit beta) (CD antigen CD29),P05556,UniProt;GO
P06576,ATP5F1B,"ATP synthase F(1) complex subunit beta, mitochondrial (EC 7.1.2.2) (ATP synthase F1 subunit beta)",P06576,UniProt;GO
P06756,ITGAV,Integrin alpha-V (Vitronectin receptor) (Vitronectin receptor subunit alpha) (CD antigen CD51) [Cleaved into: Integrin alpha-V heavy chain; Integrin alpha-V light chain],P06756,UniProt;GO
P07355,ANXA2,Annexin A2 (Annexin II) (Annexin-2) (Calpactin I heavy chain) (Calpactin-1 heavy chain) (Chromobindin-8) (Lipocortin II) (Placental anticoagulant protein IV) (PAP-IV) (Protein I) (p36),P07355,UniProt;GO
P07996,THBS1,Thrombospondin-1 (Glycoprotein G),P07996,UniProt;GO
P08253,MMP2,72 kDa type IV collagenase (EC 3.4.24.24) (72 kDa gelatinase) (Gelatinase A) (Matrix metalloproteinase-2) (MMP-2) (TBE-1) [Cleaved into: PEX],P08253,UniProt;GO
P08514,ITGA2B,"Integrin alpha-IIb (GPalpha IIb) (GPIIb) (Platelet membrane glycoprotein IIb) (CD antigen CD41) [Cleaved into: Integrin alpha-IIb heavy chain; Integrin alpha-IIb light chain, form 1; Integrin alpha-IIb light chain, form 2]",P08514,UniProt;GO
P08572,COL4A2,Collagen alpha-2(IV) chain [Cleaved into: Canstatin],P08572,UniProt;GO
P08648,ITGA5,Integrin alpha-5 (CD49 antigen-like family member E) (Fibronectin receptor subunit alpha) (Integrin alpha-F) (VLA-5) (CD antigen CD49e) [Cleaved into: Integrin alpha-5 heavy chain; Integrin alpha-5 light chain],P08648,UniProt;GO
P09038,FGF2,Fibroblast growth factor 2 (FGF-2) (Basic fibroblast growth factor) (bFGF) (Heparin-binding growth factor 2) (HBGF-2),P09038,UniProt;GO
P09601,HMOX1,Heme oxygenase 1 (HO-1) (EC 1.14.14.18) [Cleaved into: Heme oxygenase 1 soluble form],P09601,UniProt;GO
P09619,PDGFRB,Platelet-derived growth factor receptor beta (PDGF-R-beta) (PDGFR-beta) (EC 2.7.10.1) (Beta platelet-derived growth factor receptor) (Beta-type platelet-derived growth factor receptor) (CD140 antigen-like family member B) (Platelet-derived growth factor receptor 1) (PDGFR-1) (CD antigen CD140b),P09619,UniProt;GO
P0DMC3,APELA,Apelin receptor early endogenous ligand (Protein Elabela) (ELA) (Protein Toddler),P0DMC3,UniProt;GO
P10145,CXCL8,Interleukin-8 (IL-8) (C-X-C motif chemokine 8) (Chemokine (C-X-C motif) ligand 8) (Emoctakin) (Granulocyte chemotactic protein 1) (GCP-1) (Monocyte-derived neutrophil chemotactic factor) (MDNCF) (Monocyte-derived neutrophil-activating peptide) (MONAP) (Neutrophil-activating protein 1) (NAP-1) (Protein 3-10C) (T-cell chemotactic factor) [Cleaved into: MDNCF-a (GCP/IL-8 protein IV) (IL8/NAP1 form I); Interleukin-8 ((Ala-IL-8)77) (GCP/IL-8 protein II) (IL-8(1-77)) (IL8/NAP1 form II) (MDNCF-b); IL-8(5-77); IL-8(6-77) ((Ser-IL-8)72) (GCP/IL-8 protein I) (IL8/NAP1 form III) (Lymphocyte-derived neutrophil-activating factor) (LYNAP) (MDNCF-c) (Neutrophil-activating factor) (NAF); IL-8(7-77) (GCP/IL-8 protein V) (IL8/NAP1 form IV); IL-8(8-77) (GCP/IL-8 protein VI) (IL8/NAP1 form V); IL-8(9-77) (GCP/IL-8 protein III) (IL8/NAP1 form VI)],P10145,UniProt;GO
P10767,FGF6,Fibroblast growth factor 6 (FGF-6) (Heparin secretory-transforming protein 2) (HST-2) (HSTF-2) (Heparin-binding growth factor 6) (HBGF-6),P10767,UniProt;GO
P11362,FGFR1,Fibroblast growth factor receptor 1 (FGFR-1) (EC 2.7.10.1) (Basic fibroblast growth factor receptor 1) (BFGFR) (bFGF-R-1) (Fms-like tyrosine kinase 2) (FLT-2) (N-sam) (Proto-oncogene c-Fgr) (CD antigen CD331),P11362,UniProt;GO
P12644,BMP4,Bone morphogenetic protein 4 (BMP-4) (Bone morphogenetic protein 2B) (BMP-2B),P12644,UniProt;GO
P13500,CCL2,C-C motif chemokine 2 (HC11) (Monocyte chemoattractant protein 1) (Monocyte chemotactic and activating factor) (MCAF) (Monocyte chemotactic protein 1) (MCP-1) (Monocyte secretory protein JE) (Small-inducible cytokine A2),P13500,UniProt;GO
P13521,SCG2,Secretogranin-2 (Chromogranin-C) (Secretogranin II) (SgII) [Cleaved into: Secretoneurin (SN); Manserin],P13521,UniProt;GO
P13688,CEACAM1,Cell adhesion molecule CEACAM1 (Biliary glycoprotein 1) (BGP-1) (Carcinoembryonic antigen-related cell adhesion molecule 1) (CEA cell adhesion molecule 1) (CD antigen CD66a),P13688,UniProt;GO
P14651,HOXB3,Homeobox protein Hox-B3 (Homeobox protein Hox-2.7) (Homeobox protein Hox-2G),P14651,UniProt;GO
P15104,GLUL,Glutamine synthetase (GS) (EC 6.3.1.2) (Glutamate--ammonia ligase) (Palmitoyltransferase GLUL) (EC 2.3.1.225),P15104,UniProt;GO
P15144,ANPEP,Aminopeptidase N (AP-N) (hAPN) (EC 3.4.11.2) (Alanyl aminopeptidase) (Aminopeptidase M) (AP-M) (Microsomal aminopeptidase) (Myeloid plasma membrane glycoprotein CD13) (gp150) (CD antigen CD13),P15144,UniProt;GO
P15692,VEGFA,"Vascular endothelial growth factor A, long form (L-VEGF) (Vascular permeability factor) (VPF) [Cleaved into: N-VEGF; VEGFA]",P15692,UniProt;GO
P16284,PECAM1,Platelet endothelial cell adhesion molecule (PECAM-1) (EndoCAM) (GPIIA') (PECA1) (CD antigen CD31),P16284,UniProt;GO
P17252,PRKCA,Protein kinase C alpha type (PKC-A) (PKC-alpha) (EC 2.7.11.13),P17252,UniProt;GO
P17342,NPR3,Atrial natriuretic peptide receptor 3 (Atrial natriuretic peptide clearance receptor) (Atrial natriuretic peptide receptor type C) (ANP-C) (ANPR-C) (NPR-C),P17342,UniProt;GO
P17542,TAL1,T-cell acute lymphocytic leukemia protein 1 (TAL-1) (Class A basic helix-loop-helix protein 17) (bHLHa17) (Stem cell protein) (T-cell leukemia/lymphoma protein 5),P17542,UniProt;GO
P17813,ENG,Endoglin (CD antigen CD105),P17813,UniProt;GO
P17861,XBP1,"X-box-binding protein 1 (XBP-1) (Tax-responsive element-binding protein 5) (TREB-5) [Cleaved into: X-box-binding protein 1, cytoplasmic form; X-box-binding protein 1, luminal form]",P17861,UniProt;GO
P17948,FLT1,Vascular endothelial growth factor receptor 1 (VEGFR-1) (EC 2.7.10.1) (Fms-like tyrosine kinase 1) (FLT-1) (Tyrosine-protein kinase FRT) (Tyrosine-protein kinase receptor FLT) (FLT) (Vascular permeability factor receptor),P17948,UniProt;GO
P19338,NCL,Nucleolin (Protein C23),P19338,UniProt;GO
P19971,TYMP,Thymidine phosphorylase (TP) (EC 2.4.2.4) (Gliostatin) (Platelet-derived endothelial cell growth factor) (PD-ECGF) (TdRPase),P19971,UniProt;GO
P20800,EDN2,Endothelin-2 (ET-2) (Preproendothelin-2) (PPET2),P20800,UniProt;GO
P20827,EFNA1,"Ephrin-A1 (EPH-related receptor tyrosine kinase ligand 1) (LERK-1) (Immediate early response protein B61) (Tumor necrosis factor alpha-induced protein 4) (TNF alpha-induced protein 4) [Cleaved into: Ephrin-A1, secreted form]",P20827,UniProt;GO
P21453,S1PR1,Sphingosine 1-phosphate receptor 1 (S1P receptor 1) (S1P1) (Endothelial differentiation G-protein coupled receptor 1) (Sphingosine 1-phosphate receptor Edg-1) (S1P receptor Edg-1) (CD antigen CD363),P21453,UniProt;GO
P21673,SAT1,Diamine acetyltransferase 1 (EC 2.3.1.57) (Polyamine N-acetyltransferase 1) (Putrescine acetyltransferase) (Spermidine/spermine N(1)-acetyltransferase 1) (SSAT) (SSAT-1),P21673,UniProt;GO
P21709,EPHA1,Ephrin type-A receptor 1 (hEpha1) (EC 2.7.10.1) (EPH tyrosine kinase) (EPH tyrosine kinase 1) (Erythropoietin-producing hepatoma receptor) (Tyrosine-protein kinase receptor EPH),P21709,UniProt;GO
P21802,FGFR2,Fibroblast growth factor receptor 2 (FGFR-2) (EC 2.7.10.1) (K-sam) (KGFR) (Keratinocyte growth factor receptor) (CD antigen CD332),P21802,UniProt;GO
P23381,WARS1,"Tryptophan--tRNA ligase, cytoplasmic (EC 6.1.1.2) (Interferon-induced protein 53) (IFP53) (Tryptophanyl-tRNA synthetase) (TrpRS) (hWRS) [Cleaved into: T1-TrpRS; T2-TrpRS]",P23381,UniProt;GO
P23467,PTPRB,Receptor-type tyrosine-protein phosphatase beta (Protein-tyrosine phosphatase beta) (R-PTP-beta) (EC 3.1.3.48) (Vascular endothelial protein tyrosine phosphatase) (VE-PTP),P23467,UniProt;GO
P23582,NPPC,C-type natriuretic peptide [Cleaved into: CNP-22; CNP-29; CNP-53],P23582,UniProt;GO
P25067,COL8A2,Collagen alpha-2(VIII) chain (Endothelial collagen),P25067,UniProt;GO
P25101,EDNRA,Endothelin-1 receptor (Endothelin receptor type A) (ET-A) (ETA-R) (hET-AR),P25101,UniProt;GO
P25106,ACKR3,Atypical chemokine receptor 3 (C-X-C chemokine receptor type 7) (CXC-R7) (CXCR-7) (Chemokine orphan receptor 1) (G-protein coupled receptor 159) (G-protein coupled receptor RDC1 homolog) (RDC-1),P25106,UniProt;GO
P27658,COL8A1,Collagen alpha-1(VIII) chain (Endothelial collagen) [Cleaved into: Vastatin],P27658,UniProt;GO
P29279,CCN2,CCN family member 2 (Cellular communication network factor 2) (Connective tissue growth factor) (Hypertrophic chondrocyte-specific protein 24) (Insulin-like growth factor-binding protein 8) (IBP-8) (IGF-binding protein 8) (IGFBP-8),P29279,UniProt;GO
P29317,EPHA2,Ephrin type-A receptor 2 (EC 2.7.10.1) (Epithelial cell kinase) (Tyrosine-protein kinase receptor ECK),P29317,UniProt;GO
P29323,EPHB2,Ephrin type-B receptor 2 (EC 2.7.10.1) (Developmentally-regulated Eph-related tyrosine kinase) (ELK-related tyrosine kinase) (EPH tyrosine kinase 3) (EPH-like kinase 5) (EK5) (hEK5) (Renal carcinoma antigen NY-REN-47) (Tyrosine-protein kinase TYRO5) (Tyrosine-protein kinase receptor EPH-3) [Cleaved into: EphB2/CTF1; EphB2/CTF2],P29323,UniProt;GO
P29353,SHC1,SHC-transforming protein 1 (SHC-transforming protein 3) (SHC-transforming protein A) (Src homology 2 domain-containing-transforming protein C1) (SH2 domain protein C1),P29353,UniProt;GO
P29474,NOS3,"Nitric oxide synthase 3 (EC 1.14.13.39) (Constitutive NOS) (cNOS) (EC-NOS) (NOS type III) (NOSIII) (Nitric oxide synthase, endothelial) (Endothelial NOS) (eNOS)",P29474,UniProt;GO
P31151,S100A7,Protein S100-A7 (Psoriasin) (S100 calcium-binding protein A7),P31151,UniProt;GO
P31268,HOXA7,Homeobox protein Hox-A7 (Homeobox protein Hox 1.1) (Homeobox protein Hox-1A),P31268,UniProt;GO
P31371,FGF9,Fibroblast growth factor 9 (FGF-9) (Glia-activating factor) (GAF) (Heparin-binding growth factor 9) (HBGF-9),P31371,UniProt;GO
P35222,CTNNB1,Catenin beta-1 (Beta-catenin),P35222,UniProt;GO
P35398,RORA,Nuclear receptor ROR-alpha (Nuclear receptor RZR-alpha) (Nuclear receptor subfamily 1 group F member 1) (RAR-related orphan receptor A) (Retinoid-related orphan receptor-alpha),P35398,UniProt;GO
P35414,APLNR,Apelin receptor (Angiotensin receptor-like 1) (G-protein coupled receptor APJ) (G-protein coupled receptor HG11),P35414,UniProt;GO
P35579,MYH9,"Myosin-9 (Cellular myosin heavy chain, type A) (Myosin heavy chain 9) (Myosin heavy chain, non-muscle IIa) (Non-muscle myosin heavy chain A) (NMMHC-A) (Non-muscle myosin heavy chain IIa) (NMMHC II-a) (NMMHC-IIA)",P35579,UniProt;GO
P35590,TIE1,Tyrosine-protein kinase receptor Tie-1 (EC 2.7.10.1),P35590,UniProt;GO
P35613,BSG,Basigin (5F7) (Collagenase stimulatory factor) (Extracellular matrix metalloproteinase inducer) (EMMPRIN) (Hepatoma-associated antigen) (HAb18G) (Leukocyte activation antigen M6) (OK blood group antigen) (Tumor cell-derived collagenase stimulatory factor) (TCSF) (CD antigen CD147),P35613,UniProt;GO
P35713,SOX18,Transcription factor SOX-18,P35713,UniProt;GO
P35916,FLT4,Vascular endothelial growth factor receptor 3 (VEGFR-3) (EC 2.7.10.1) (Fms-like tyrosine kinase 4) (FLT-4) (Tyrosine-protein kinase receptor FLT4),P35916,UniProt;GO
P35968,KDR,Vascular endothelial growth factor receptor 2 (VEGFR-2) (EC 2.7.10.1) (Fetal liver kinase 1) (FLK-1) (Kinase insert domain receptor) (KDR) (Protein-tyrosine kinase receptor flk-1) (CD antigen CD309),P35968,UniProt;GO
P36382,GJA5,Gap junction alpha-5 protein (Connexin-40) (Cx40),P36382,UniProt;GO
P36894,BMPR1A,Bone morphogenetic protein receptor type-1A (BMP type-1A receptor) (BMPR-1A) (EC 2.7.11.30) (Activin receptor-like kinase 3) (ALK-3) (Serine/threonine-protein kinase receptor R5) (SKR5) (CD antigen CD292),P36894,UniProt;GO
P36897,TGFBR1,TGF-beta receptor type-1 (TGFR-1) (EC 2.7.11.30) (Activin A receptor type II-like protein kinase of 53kD) (Activin receptor-like kinase 5) (ALK-5) (ALK5) (Serine/threonine-protein kinase receptor R4) (SKR4) (TGF-beta type I receptor) (Transforming growth factor-beta receptor type I) (TGF-beta receptor type I) (TbetaR-I),P36897,UniProt;GO
P37023,ACVRL1,Activin receptor type-1-like (EC 2.7.11.30) (Activin receptor-like kinase 1) (ALK-1) (Serine/threonine-protein kinase receptor R3) (SKR3) (TGF-B superfamily receptor type I) (TSR-I),P37023,UniProt;GO
P39059,COL15A1,Collagen alpha-1(XV) chain [Cleaved into: Restin (Endostatin-XV) (Related to endostatin) (Restin-I); Restin-2 (Restin-II); Restin-3 (Restin-III); Restin-4 (Restin-IV)],P39059,UniProt;GO
P39060,COL18A1,Collagen alpha-1(XVIII) chain [Cleaved into: Endostatin; Non-collagenous domain 1 (NC1)],P39060,UniProt;GO
P41134,ID1,DNA-binding protein inhibitor ID-1 (Class B basic helix-loop-helix protein 24) (bHLHb24) (Inhibitor of DNA binding 1) (Inhibitor of differentiation 1),P41134,UniProt;GO
P41159,LEP,Leptin (Obese protein) (Obesity factor),P41159,UniProt;GO
P41970,ELK3,ETS domain-containing protein Elk-3 (ETS-related protein ERP) (ETS-related protein NET) (Serum response factor accessory protein 2) (SAP-2) (SRF accessory protein 2),P41970,UniProt;GO
P42336,PIK3CA,"Phosphatidylinositol 4,5-bisphosphate 3-kinase catalytic subunit alpha isoform (PI3-kinase subunit alpha) (PI3K-alpha) (PI3Kalpha) (PtdIns-3-kinase subunit alpha) (EC 2.7.1.137) (EC 2.7.1.153) (Phosphatidylinositol 4,5-bisphosphate 3-kinase 110 kDa catalytic subunit alpha) (PtdIns-3-kinase subunit p110-alpha) (p110alpha) (Phosphoinositide 3-kinase alpha) (Phosphoinositide-3-kinase catalytic alpha polypeptide) (Serine/threonine protein kinase PIK3CA) (EC 2.7.11.1)",P42336,UniProt;GO
P43121,MCAM,Cell surface glycoprotein MUC18 (Cell surface glycoprotein P1H12) (Melanoma cell adhesion molecule) (Melanoma-associated antigen A32) (Melanoma-associated antigen MUC18) (S-endo 1 endothelial-associated antigen) (CD antigen CD146),P43121,UniProt;GO
P43405,SYK,Tyrosine-protein kinase SYK (EC 2.7.10.2) (Spleen tyrosine kinase) (p72-Syk),P43405,UniProt;GO
P46531,NOTCH1,Neurogenic locus notch homolog protein 1 (Notch 1) (hN1) (Translocation-associated notch protein TAN-1) [Cleaved into: Notch 1 extracellular truncation (NEXT); Notch 1 intracellular domain (NICD)],P46531,UniProt;GO
P48357,LEPR,Leptin receptor (LEP-R) (HuB219) (OB receptor) (OB-R) (CD antigen CD295),P48357,UniProt;GO
P48736,PIK3CG,"Phosphatidylinositol 4,5-bisphosphate 3-kinase catalytic subunit gamma isoform (PI3-kinase subunit gamma) (PI3K-gamma) (PI3Kgamma) (PtdIns-3-kinase subunit gamma) (EC 2.7.1.137) (EC 2.7.1.153) (EC 2.7.1.154) (Phosphatidylinositol 4,5-bisphosphate 3-kinase 110 kDa catalytic subunit gamma) (PtdIns-3-kinase subunit p110-gamma) (p110gamma) (Phosphoinositide-3-kinase catalytic gamma polypeptide) (Serine/threonine protein kinase PIK3CG) (EC 2.7.11.1) (p120-PI3K)",P48736,UniProt;GO
P48745,CCN3,CCN family member 3 (Cellular communication network factor 3) (Insulin-like growth factor-binding protein 9) (IBP-9) (IGF-binding protein 9) (IGFBP-9) (Nephro blastoma-overexpressed gene protein homolog) (Protein NOV homolog) (NovH),P48745,UniProt;GO
P49682,CXCR3,C-X-C chemokine receptor type 3 (CXC-R3) (CXCR-3) (CKR-L2) (G protein-coupled receptor 9) (Interferon-inducible protein 10 receptor) (IP-10 receptor) (CD antigen CD183),P49682,UniProt;GO
P49685,GPR15,G-protein coupled receptor 15 (Brother of Bonzo) (BoB),P49685,UniProt;GO
P49763,PGF,Placenta growth factor (PlGF),P49763,UniProt;GO
P49767,VEGFC,Vascular endothelial growth factor C (VEGF-C) (Flt4 ligand) (Flt4-L) (Vascular endothelial growth factor-related protein) (VRP),P49767,UniProt;GO
P50222,MEOX2,Homeobox protein MOX-2 (Growth arrest-specific homeobox) (Mesenchyme homeobox 2),P50222,UniProt;GO
P50281,MMP14,Matrix metalloproteinase-14 (MMP-14) (EC 3.4.24.80) (MMP-X1) (Membrane-type matrix metalloproteinase 1) (MT-MMP 1) (MTMMP1) (Membrane-type-1 matrix metalloproteinase) (MT1-MMP) (MT1MMP),P50281,UniProt;GO
P50895,BCAM,Basal cell adhesion molecule (Auberger B antigen) (B-CAM cell surface glycoprotein) (F8/G253 antigen) (Lutheran antigen) (Lutheran blood group glycoprotein) (CD antigen CD239),P50895,UniProt;GO
P51817,PRKX,cAMP-dependent protein kinase catalytic subunit PRKX (PrKX) (Protein kinase X) (Protein kinase X-linked) (Serine/threonine-protein kinase PRKX) (EC 2.7.11.1) (Protein kinase PKX1),P51817,UniProt;GO
P52735,VAV2,Guanine nucleotide exchange factor VAV2 (VAV-2),P52735,UniProt;GO
P52799,EFNB2,Ephrin-B2 (EPH-related receptor tyrosine kinase ligand 5) (LERK-5) (HTK ligand) (HTK-L),P52799,UniProt;GO
P54753,EPHB3,Ephrin type-B receptor 3 (EC 2.7.10.1) (EPH-like tyrosine kinase 2) (EPH-like kinase 2) (Embryonic kinase 2) (EK2) (hEK2) (Tyrosine-protein kinase TYRO6),P54753,UniProt;GO
P54760,EPHB4,Ephrin type-B receptor 4 (EC 2.7.10.1) (Hepatoma transmembrane kinase) (Tyrosine-protein kinase TYRO11),P54760,UniProt;GO
P54762,EPHB1,Ephrin type-B receptor 1 (EC 2.7.10.1) (ELK) (EPH tyrosine kinase 2) (EPH-like kinase 6) (EK6) (hEK6) (Neuronally-expressed EPH-related tyrosine kinase) (NET) (Tyrosine-protein kinase receptor EPH-2),P54762,UniProt;GO
P55347,PKNOX1,Homeobox protein PKNOX1 (Homeobox protein PREP-1) (PBX/knotted homeobox 1),P55347,UniProt;GO
P57082,TBX4,T-box transcription factor TBX4 (T-box protein 4),P57082,UniProt;GO
P58294,PROK1,Prokineticin-1 (Endocrine-gland-derived vascular endothelial growth factor) (EG-VEGF) (Mambakine),P58294,UniProt;GO
P58400,NRXN1,Neurexin-1-beta (Neurexin I-beta),P58400,UniProt;GO
P59773,MINAR2,Major intrinsically disordered NOTCH2-binding receptor 1-like (Major intrinsically disordered NOTCH2-associated receptor 2) (Membrane integral NOTCH2-associated receptor 2),P59773,UniProt;GO
P61296,HAND2,"Heart- and neural crest derivatives-expressed protein 2 (Class A basic helix-loop-helix protein 26) (bHLHa26) (Deciduum, heart, autonomic nervous system and neural crest derivatives-expressed protein 2) (dHAND)",P61296,UniProt;GO
P62745,RHOB,Rho-related GTP-binding protein RhoB (Rho cDNA clone 6) (h6),P62745,UniProt;GO
P63104,YWHAZ,14-3-3 protein zeta/delta (Protein kinase C inhibitor protein 1) (KCIP-1),P63104,UniProt;GO
P63261,ACTG1,"Actin, cytoplasmic 2 (EC 3.6.4.-) (Gamma-actin) [Cleaved into: Actin, cytoplasmic 2, N-terminally processed]",P63261,UniProt;GO
P78325,ADAM8,Disintegrin and metalloproteinase domain-containing protein 8 (ADAM 8) (EC 3.4.24.-) (Cell surface antigen MS2) (CD antigen CD156a),P78325,UniProt;GO
P78362,SRPK2,SRSF protein kinase 2 (EC 2.7.11.1) (SFRS protein kinase 2) (Serine/arginine-rich protein-specific kinase 2) (SR-protein-specific kinase 2) [Cleaved into: SRSF protein kinase 2 N-terminal; SRSF protein kinase 2 C-terminal],P78362,UniProt;GO
P78504,JAG1,Protein jagged-1 (Jagged1) (hJ1) (CD antigen CD339),P78504,UniProt;GO
P98160,HSPG2,Basement membrane-specific heparan sulfate proteoglycan core protein (HSPG) (Perlecan) (PLC) [Cleaved into: Endorepellin; LG3 peptide],P98160,UniProt;GO
Q00604,NDP,Norrin (Norrie disease protein) (X-linked exudative vitreoretinopathy 2 protein),Q00604,UniProt;GO
Q02763,TEK,Angiopoietin-1 receptor (EC 2.7.10.1) (Endothelial tyrosine kinase) (Tunica interna endothelial cell kinase) (Tyrosine kinase with Ig and EGF homology domains-2) (Tyrosine-protein kinase receptor TEK) (Tyrosine-protein kinase receptor TIE-2) (hTIE2) (p140 TEK) (CD antigen CD202b),Q02763,UniProt;GO
Q03135,CAV1,Caveolin-1,Q03135,UniProt;GO
Q03169,TNFAIP2,Tumor necrosis factor alpha-induced protein 2 (TNF alpha-induced protein 2) (Primary response gene B94 protein),Q03169,UniProt;GO
Q05397,PTK2,Focal adhesion kinase 1 (FADK 1) (EC 2.7.10.2) (Focal adhesion kinase-related nonkinase) (FRNK) (Protein phosphatase 1 regulatory subunit 71) (PPP1R71) (Protein-tyrosine kinase 2) (p125FAK) (pp125FAK),Q05397,UniProt;GO
Q06330,RBPJ,Recombining binding protein suppressor of hairless (CBF-1) (J kappa-recombination signal-binding protein) (RBP-J kappa) (RBP-J) (RBP-JK) (Renal carcinoma antigen NY-REN-30),Q06330,UniProt;GO
Q07075,ENPEP,Glutamyl aminopeptidase (EAP) (EC 3.4.11.7) (Aminopeptidase A) (AP-A) (Differentiation antigen gp160) (CD antigen CD249),Q07075,UniProt;GO
Q08431,MFGE8,Lactadherin (Breast epithelial antigen BA46) (HMFG) (MFGM) (Milk fat globule-EGF factor 8) (MFG-E8) (SED1) [Cleaved into: Lactadherin short form; Medin],Q08431,UniProt;GO
